{
  "owner_name": "Duot Kuer",
  "tagline": "Built by Duot Kuer",
  "links": [
    {
      "label": "GitHub",
      "url": "https://github.com/duotkuerduot"
    }
  ],
  "attribution": "Wanjawa, Barack (2026), \"Kenya Nairobi Securities Exchange (NSE) All Stocks Prices 2026\", Mendeley Data, V1, doi: 10.17632/hvmhnp7f9r.1"
}
